$ ./mjoin en0 224.1.2.3

$ netstat -ina -I en0
...
en0   1500  192.168.0     192.168.0.200     802819     -   937359     -     -
                        224.1.2.3
                        224.0.0.251
                        224.0.0.1

$ sudo tcpdump -n -i en0 'igmp'
09:58:31.983952 IP 192.168.0.200 > 224.1.2.3: igmp v2 report 224.1.2.3
09:58:32.093327 IP 192.168.0.1 > 224.0.0.1: igmp query v2 [gaddr 224.1.2.3]
09:58:37.489654 IP 192.168.0.200 > 224.0.0.2: igmp leave 224.1.2.3

gongcunjust@macosx[ch13]# ./mjoin en0 224.1.2.3
^C
gongcunjust@macosx[ch13]# ./mjoin en0 224.1.2.3
^C

$ sudo ./igmpdump en0
2016-11-25 22:03:55.874563 IP 192.168.0.200 > 224.1.2.3: IGMP v2 report 224.1.2.3 [ttl 1]
2016-11-25 22:04:14.909401 IP 192.168.0.200 > 224.0.0.2: IGMP leave 224.1.2.3 [ttl 1]
2016-11-25 22:04:14.909403 IP 192.168.0.200 > 224.1.2.3: IGMP v2 report 224.1.2.3 [ttl 1]
2016-11-25 22:04:15.016175 IP 192.168.0.1 > 224.0.0.1: IGMP v2 query [gattr 224.1.2.3] [max resp time 100] [ttl 1]
2016-11-25 22:04:15.410023 IP 192.168.0.200 > 224.1.2.3: IGMP v2 report 224.1.2.3 [ttl 1]

